{
  "$schema": "https://json-schema.org/draft/2020-12/schema",
  "$id": "https://example.invalid/golden-path/artifact.schema.json",
  "$ref": "#/$defs/artifact",
  "$defs": {
    "text": { "type": "string", "minLength": 1, "pattern": "\\S" },
    "id": { "type": "string", "pattern": "^[a-z][a-z0-9]*(-[a-z0-9]+)+$" },
    "ids": { "type": "array", "minItems": 1, "uniqueItems": true, "items": { "$ref": "#/$defs/id" } },
    "texts": { "type": "array", "minItems": 1, "uniqueItems": true, "items": { "$ref": "#/$defs/text" } },
    "authority": { "enum": ["READ", "RECOMMEND", "PROPOSE", "WRITE", "HIGH_IMPACT_WRITE"] },
    "artifact": {
      "type": "object", "additionalProperties": false, "required": ["schemaVersion", "id", "kind", "title", "spec"],
      "properties": {
        "$schema": { "const": "../contracts/engineering.schema.json" }, "schemaVersion": { "const": 2 },
        "id": { "$ref": "#/$defs/id" }, "title": { "$ref": "#/$defs/text" }, "spec": { "type": "object" },
        "kind": { "enum": ["outcome", "workload", "requirement", "decision", "capability", "implementation", "evaluation", "evidence", "policy", "agent", "skill"] }
      },
      "allOf": [
        { "if": { "properties": { "kind": { "const": "outcome" } } }, "then": { "properties": { "spec": { "$ref": "#/$defs/outcome" } } } },
        { "if": { "properties": { "kind": { "const": "workload" } } }, "then": { "properties": { "spec": { "$ref": "#/$defs/workload" } } } },
        { "if": { "properties": { "kind": { "const": "decision" } } }, "then": { "properties": { "spec": { "$ref": "#/$defs/decision" } } } },
        { "if": { "properties": { "kind": { "const": "requirement" } } }, "then": { "properties": { "spec": { "$ref": "#/$defs/requirement" } } } },
        { "if": { "properties": { "kind": { "const": "capability" } } }, "then": { "properties": { "spec": { "$ref": "#/$defs/capability" } } } },
        { "if": { "properties": { "kind": { "const": "implementation" } } }, "then": { "properties": { "spec": { "$ref": "#/$defs/implementation" } } } },
        { "if": { "properties": { "kind": { "const": "evaluation" } } }, "then": { "properties": { "spec": { "$ref": "#/$defs/evaluation" } } } },
        { "if": { "properties": { "kind": { "const": "evidence" } } }, "then": { "properties": { "spec": { "$ref": "#/$defs/evidence" } } } },
        { "if": { "properties": { "kind": { "const": "policy" } } }, "then": { "properties": { "spec": { "$ref": "#/$defs/policy" } } } },
        { "if": { "properties": { "kind": { "const": "agent" } } }, "then": { "properties": { "spec": { "$ref": "#/$defs/agent" } } } },
        { "if": { "properties": { "kind": { "const": "skill" } } }, "then": { "properties": { "spec": { "$ref": "#/$defs/skill" } } } }
      ]
    },
    "outcome": {
      "type": "object", "additionalProperties": false, "required": ["metric", "target"],
      "properties": { "metric": { "$ref": "#/$defs/text" }, "target": { "$ref": "#/$defs/text" } }
    },
    "workload": {
      "type": "object", "additionalProperties": false, "required": ["outcomeId", "owner", "stage", "usesAI", "acceptance"],
      "properties": {
        "outcomeId": { "$ref": "#/$defs/id" }, "owner": { "$ref": "#/$defs/text" }, "stage": { "enum": ["design", "development", "production"] }, "usesAI": { "type": "boolean" },
        "acceptance": { "type": "array", "minItems": 1, "items": {
          "type": "object", "additionalProperties": false, "required": ["id", "metric", "target"],
          "properties": { "id": { "$ref": "#/$defs/id" }, "metric": { "$ref": "#/$defs/text" }, "target": { "$ref": "#/$defs/text" } }
        } }
      }
    },
    "requirement": {
      "type": "object", "additionalProperties": false, "required": ["workloadId", "acceptanceIds", "description"],
      "properties": { "workloadId": { "$ref": "#/$defs/id" }, "acceptanceIds": { "$ref": "#/$defs/ids" }, "description": { "$ref": "#/$defs/text" } }
    },
    "decision": {
      "type": "object", "additionalProperties": false,
      "required": ["requirementIds", "status", "unmetRequirement", "simplestViableOption", "selectedOption", "capabilityGained", "alternatives", "simplerOptionAssessment", "operationalResponsibility", "rationale"],
      "properties": {
        "requirementIds": { "$ref": "#/$defs/ids" }, "status": { "enum": ["proposed", "approved", "rejected", "superseded"] },
        "unmetRequirement": { "$ref": "#/$defs/text" }, "simplestViableOption": { "$ref": "#/$defs/text" }, "selectedOption": { "$ref": "#/$defs/text" },
        "capabilityGained": { "$ref": "#/$defs/text" }, "alternatives": { "$ref": "#/$defs/texts" }, "simplerOptionAssessment": { "$ref": "#/$defs/text" },
        "operationalResponsibility": { "$ref": "#/$defs/text" }, "rationale": { "$ref": "#/$defs/text" }, "evidenceIds": { "$ref": "#/$defs/ids" },
        "approval": { "type": "object", "additionalProperties": false, "required": ["reviewer", "date", "source", "statement", "scope"], "properties": {
          "reviewer": { "$ref": "#/$defs/text" }, "date": { "type": "string", "pattern": "^\\d{4}-\\d{2}-\\d{2}$" }, "source": { "$ref": "#/$defs/text" },
          "statement": { "$ref": "#/$defs/text" }, "scope": { "$ref": "#/$defs/text" }
        } },
        "authorityChanges": { "type": "array", "minItems": 1, "items": {
          "type": "object", "additionalProperties": false, "required": ["capabilityId", "from", "to", "reason"],
          "properties": { "capabilityId": { "$ref": "#/$defs/id" }, "from": { "$ref": "#/$defs/authority" }, "to": { "$ref": "#/$defs/authority" }, "reason": { "$ref": "#/$defs/text" } }
        } }
      }
    },
    "capability": {
      "type": "object", "additionalProperties": false, "required": ["decisionId", "executable", "authority", "identity", "boundary"],
      "properties": {
        "decisionId": { "$ref": "#/$defs/id" }, "executable": { "type": "boolean" }, "authority": { "$ref": "#/$defs/authority" },
        "identity": { "$ref": "#/$defs/text" }, "boundary": { "$ref": "#/$defs/text" }, "policyId": { "$ref": "#/$defs/id" },
        "authorization": { "type": "object", "additionalProperties": false, "required": ["principal", "scope", "enforcement", "deniedBehavior"], "properties": {
          "principal": { "$ref": "#/$defs/text" }, "scope": { "$ref": "#/$defs/text" }, "enforcement": { "$ref": "#/$defs/text" }, "deniedBehavior": { "$ref": "#/$defs/text" }
        } }
      }
    },
    "implementation": {
      "type": "object", "additionalProperties": false, "required": ["capabilityIds", "paths", "state"],
      "properties": { "capabilityIds": { "$ref": "#/$defs/ids" }, "paths": { "$ref": "#/$defs/texts" }, "state": { "enum": ["draft", "active"] } }
    },
    "evaluation": {
      "type": "object", "additionalProperties": false, "required": ["requirementIds", "capabilityIds", "method", "scenarios", "passCriteria", "procedure"],
      "properties": {
        "requirementIds": { "$ref": "#/$defs/ids" }, "capabilityIds": { "$ref": "#/$defs/ids" },
        "method": { "enum": ["deterministic", "behavioral", "security", "policy", "operational", "manual"] },
        "scenarios": { "$ref": "#/$defs/texts" }, "passCriteria": { "$ref": "#/$defs/text" }, "procedure": { "$ref": "#/$defs/text" },
        "operational": { "type": "object", "additionalProperties": false, "required": ["signal", "owner", "retention"], "properties": {
          "signal": { "$ref": "#/$defs/text" }, "owner": { "$ref": "#/$defs/text" }, "retention": { "$ref": "#/$defs/text" }
        } }
      }
    },
    "evidence": {
      "type": "object", "additionalProperties": false, "required": ["evaluationId", "subjectRevision", "recordedAt", "result", "location", "environment", "observations"],
      "properties": {
        "evaluationId": { "$ref": "#/$defs/id" }, "subjectRevision": { "$ref": "#/$defs/text" }, "recordedAt": { "type": "string", "pattern": "^\\d{4}-\\d{2}-\\d{2}T\\d{2}:\\d{2}:\\d{2}Z$" },
        "result": { "enum": ["pass", "fail", "inconclusive"] }, "location": { "$ref": "#/$defs/text" }, "environment": { "enum": ["development", "production"] }, "observations": { "$ref": "#/$defs/text" }
      }
    },
    "policy": {
      "type": "object", "additionalProperties": false, "required": ["requirementIds", "rules", "approval", "failureHandling", "observability"],
      "properties": {
        "requirementIds": { "$ref": "#/$defs/ids" }, "rules": { "$ref": "#/$defs/texts" },
        "approval": { "type": "object", "additionalProperties": false, "required": ["mode", "rationale", "enforcement"], "properties": {
          "mode": { "enum": ["human", "automated", "none"] }, "rationale": { "$ref": "#/$defs/text" }, "enforcement": { "$ref": "#/$defs/text" }
        } }, "failureHandling": { "$ref": "#/$defs/text" }, "observability": { "$ref": "#/$defs/text" }
      }
    },
    "agent": {
      "type": "object", "additionalProperties": false, "required": ["capabilityIds", "boundary", "path"],
      "properties": {
        "capabilityIds": { "$ref": "#/$defs/ids" }, "boundary": { "enum": ["primary", "subagent", "independent"] }, "path": { "$ref": "#/$defs/text" },
        "justification": { "type": "object", "additionalProperties": false, "required": ["basis", "requirementId", "evidenceIds", "reason"], "properties": {
          "basis": { "enum": ["execution", "context", "authority", "lifecycle", "parallelism", "control"] }, "requirementId": { "$ref": "#/$defs/id" }, "evidenceIds": { "$ref": "#/$defs/ids" }, "reason": { "$ref": "#/$defs/text" }
        } }
      }
    },
    "skill": {
      "type": "object", "additionalProperties": false, "required": ["decisionId", "path", "references", "authority"],
      "properties": { "decisionId": { "$ref": "#/$defs/id" }, "path": { "$ref": "#/$defs/text" }, "references": { "$ref": "#/$defs/texts" }, "authority": { "const": "NONE" } }
    }
  }
}