{
  "$schema": "../contracts/engineering.schema.json",
  "schemaVersion": 2, "id": "out-engineering", "kind": "outcome",
  "title": "Preserve engineering intent while deriving the simplest justified implementation",
  "spec": {
    "metric": "Structural regressions and human-reviewed behavioral scenarios satisfying acceptance",
    "target": "All structural assertions pass; all A-F behavioral scenarios pass human review before claiming bootstrap behavioral acceptance"
  }
}